{"$schema":"https://json-schema.org/draft/2020-12/schema","type":"object","required":["schemaVersion","gateId","phaseId","title","objective","status","dependsOn","acceptanceCriteria","allowedActions","forbiddenActions","verification","riskClass","requiresApproval","completionEvidence"],"properties":{"schemaVersion":{"const":1},"gateId":{"type":"string"},"phaseId":{"type":"string"},"title":{"type":"string"},"objective":{"type":"string"},"status":{"enum":["CURRENT","PENDING","PASS","BLOCKED","COMPLETE"]},"dependsOn":{"type":"array"},"acceptanceCriteria":{"type":"array"},"allowedActions":{"type":"array"},"forbiddenActions":{"type":"array"},"verification":{"type":"array"},"riskClass":{"enum":["LOW","MEDIUM","HIGH"]},"requiresApproval":{"type":"boolean"},"completionEvidence":{"type":"array"}},"additionalProperties":false,"schemaVersion":1}